id,love,joy,surprise,anger,sadness,fear,notes,comment N,comment N-1,comment N-2,...,comment 2,comment1,,,,,,,,
46121,,,,,,,,----------------------------------------------------------- This is an automatically generated e-mail. To reply; visit: https://reviews.apache.org/r/1023/ ----------------------------------------------------------- (Updated 2011-07-08 20:04:37.543693) Review request for Thrift. Changes ------- Adding bug number for tracking. Summary ------- Remove bogus include. TAsyncChannel includes TTransportUtils but doesn't need/use it. This addresses bug THRIFT-1231. https://issues.apache.org/jira/browse/THRIFT-1231 Diffs /lib/cpp/src/async/TAsyncChannel.h 1143615 Diff: https://reviews.apache.org/r/1023/diff Testing ------- make check in lib/cpp Thanks; Diwaker,,,,,,,,,,,,,
58473,,,,,,,,rules/,,,,,,,,,,,,,
78759,x,,,,,,,Fixed; thanks for the patch. http://svn.apache.org/viewcvs.cgi?rev=354520&view=rev,,,,,,,,,,,,,
26572,x,,,,,,,Thanks for testing; Shinobu. Probably a misconfiguration. Chris; try asking on the user list if this problem persists.,,,,,,,,,,,,,
17727,,,,,,,,Verified. I added the info to the RELEASE_NOTES file.,I'm closing this as we aren't planning to implement the only remaining issue. I propose we just add an item to the release notes that we're 99% conformant apart from child iframe support.,WOOKIE-308 is the only remaining issue affecting conformance; we aren't going to fix that for 0.9.2 so I'll re-open this issue and punt to 0.10.0 to fix along with WOOKIE-308,OK; I've checked again and it looks like the WebStorage spec changed or I misinterpreted it: while clear() must remove the entries; getItem() must return Null rather than undefined when requesting a non-existing item: widget.preferences.clear(); // get rid of everything widget.preferences.setItem('foo'; null); // set 'foo' to equal null widget.preferences.getItem('foo'); // tuple exists and is set to null; return null widget.preferences.getItem('completely_undefined_bar'); tuple doesn't exist; return null I've updated Wookie and we can now pass test 'at'. We don't pass 'au' but I'll raise another issue for that.,(commits in the w3c test cases repo; not wookie!),OK; looks like my commits fixing the two tests were reverted; so no wonder at and au fail now. I'll follow that up and see if I can resolve it.,Hmm; I updated the 'at' and 'au' test cases at W3C to check for typeof==='undefined' rather than Null so they shouldn't be failing now...,I have just re-run all these tests on Windows 7; in the following environments... IE 9 Firefox 9.0.1 Opera 11.10 Google Chrome 16.0.912.75 m and the results were the same in each case... Test 'return-empty-strings' fails because widget.id returns wookies internal generated Id (expected behavior for wookie) Test 'setItem-fires-event' fails (storage event from iframe) Test 'removeItem-fires-event' fails (storage event from iframe) Test 'clearItem-fires-event' fails (storage event from iframe) Test 'Test at' fails because widget expects window.widget.preferences.getItem('deletable') to be null. it is actually 'undefined' Test 'au' fails because widget expects prefs.getItem('test1') to be null. it is actually 'undefined' It looks to me that this is in keeping with Scotts results; ok to verifiy now?,So here's the summary: #1 Fixed #2 Not a bug - I think its reasonable we pass on generated ids in the metadata #3 I don't think its really relevant as its an edge case. If anyone asks for sending storage events to child frames we can do it; but its not exactly urgent. #4 This is a test error - I've filed a bug with w3c ... so I'm closing the issue,I've fixed the engine.js error - this was caused by trying to delete prefs that throw a NO_MODIFICATION_ALLOWED_ERR . However the test case itself seems to be wrong as it expects cleared prefs to be === Null rather than typeof 'undefined'.,Current test results (0.9.2 rev 1199782) show mostly green; the following red: 1 Test preferences_attrreadonly failed because preferences in window.widget is not read-only 2 Test return-emtpy-strings failed because one of the attributes returned an incorrect value 3 Test did not run or storage event was never fired. 4 Test au failed because the values of the stored preferences were not what they should have been. #1 is because the preferences attribute itself is not read-only #2 is because we always generate an ID for a widget; even if it doesn't have one by default. #3 is a bit of a strange one to implement I'm not sure what causes the problem with #4; but it throws an engine.js error.,,,
27659,,,,,,,,Closing as FIXED,,,,,,,,,,,,,
2463,x,,,,,,,Added a couple small points I missed before; and fixed (I hope) some formatting. Thanks. If anyone notices any misuses of the document formatting please let me know. Thanks!,,,,,,,,,,,,,
12298,x,,,,,,,The issue is very old. Can you please confirm it with the latest CVS source cut ? Thanks!,,,,,,,,,,,,,
67087,,,,,,,,resolved,,,,,,,,,,,,,
63758,,,,,,,,Committed revision 682671. Added an excludes for **/target/ to the patch to make sure the DataImportHandler binaries do not get packaged. Thanks Jeremy!,Quick patch to add contrib/** to the package task. This may be all that is required; but I'm not for sure.,,,,,,,,,,,,
48779,x,,,,,,,Thanks for the issue / steps to resolve. Pretty much did what you said verbatim. (as it worked out on the other regexp issue),,,,,,,,,,,,,
16927,,,,,,,,I'll update the javadoc accordingly.,,,,,,,,,,,,,
65869,,,,,,,,please apply these two patches in the $SMX4.0/runtime/trunk & $SMX4.0/nmr/trunk respectively. As Guillaume's mentioned above: Define a deploymentListener in the filemonitor module. Define a JBI artifactDeployment Listener for dealing with JBI artifact; to transform it to OSGified bundle automatically. With these two little patch; users can put JBI artifact in the deploy folder directly to install & start it.,,,,,,,,,,,,,
9798,,,,,,,,closing this issue.,,,,,,,,,,,,,
50490,,,,,,,,Integrated in tapestry-trunk-freestyle #515 (See [https://builds.apache.org/job/tapestry-trunk-freestyle/515/]) åÊåÊåÊåÊTAP5-1621 - Fixed test joshcanfield : http://svn.apache.org/viewcvs.cgi/?root=Apache-SVN&view=rev&rev=1167447 Files : * /tapestry/tapestry5/trunk/tapestry-ioc/src/test/java/org/apache/tapestry5/ioc/internal/services/TypeCoercerImplTest.java,,,,,,,,,,,,,
14571,,x,,,,,,yay! it should be really really easy (not including the test; I think it's just deleting 6 characters),If time permits; I'm planning to do a backport of some issues for a Struts 2.0 maintainance release. This one would definitely make it into the port.,I agree! Please backport to a 2.0.x release!,Is there any chance this fix could be backported to a 2.0.x release?,Well; in the current code; your change has been made (by me it seems); so how warnings will be printed; but the property setting will continue. I still think this should be handled better; but it should be fine for now since it works the way we want but will just print out warnings in the semi-rare case the result uses the parameters for something they weren't intended for; which at this point; it seems only to be the ServletActionRedirectResult.,The reason exceptions are ignored is result parameters are not always meant to be applied as setters. For example; the redirect results programatically access the parameters and interpret them as parameters to set on the redirect request. Therefore; there is no corresponding setter and OGNL will throw an exception. Certainly; the current implementation is ideal; but just having exceptions thrown is not the solution. Perhaps we let results declare themselves as supporting 'strict' parameter assignments?,I'm habitual...here is the patch with the Struts 2 code formatting rather than my company's formatting. Sorry for the confusion! thanks; aaron,Don't use this one...non standard code formatting.,Patch for project created from project root; includes proposed fix and test case. Proposed fix is simply to call to a more restrictive setProperties() on the OgnlUtils class which prevents exceptions from being thrown during binding. Don't use this one...non standard code formatting. See newest attachment.,If you come up with a proposed fix; please post the patch to this ticket.,,,,
38291,,,,,,,,I should have marked this resolved back in September.,,,,,,,,,,,,,
45835,,,,,,,,Integrated in Thrift #407 (See https://builds.apache.org/job/Thrift/407/) THRIFT-1517 TTransport.ReadAll() should set exception type to EndOfFile Patch: Stefan Gmeiner (Revision 1291039) Result = SUCCESS roger : http://svn.apache.org/viewvc/?view=rev&rev=1291039 Files : /thrift/trunk/lib/csharp/src/Transport/TTransport.cs,,,,,,,,,,,,,
58874,,,,,,,,Committing to https://svn.apache.org/repos/asf/mina/sshd/trunk ... M sshd-core/src/main/java/org/apache/sshd/client/UserAuth.java M sshd-core/src/main/java/org/apache/sshd/client/auth/UserAuthAgent.java M sshd-core/src/main/java/org/apache/sshd/client/auth/UserAuthPassword.java M sshd-core/src/main/java/org/apache/sshd/client/auth/UserAuthPublicKey.java M sshd-core/src/main/java/org/apache/sshd/client/session/ClientSessionImpl.java M sshd-core/src/main/java/org/apache/sshd/common/Session.java M sshd-core/src/main/java/org/apache/sshd/common/session/AbstractSession.java M sshd-core/src/main/java/org/apache/sshd/server/FileSystemFactory.java M sshd-core/src/main/java/org/apache/sshd/server/FileSystemView.java M sshd-core/src/main/java/org/apache/sshd/server/channel/ChannelSession.java M sshd-core/src/main/java/org/apache/sshd/server/command/ScpCommand.java M sshd-core/src/main/java/org/apache/sshd/server/filesystem/NativeFileSystemFactory.java M sshd-core/src/main/java/org/apache/sshd/server/filesystem/NativeFileSystemView.java M sshd-core/src/main/java/org/apache/sshd/server/session/ServerSession.java Committed r1039541,This patch adds support for the Virtual Filesystem for SCP and allowd information exchange between the authenticator and the filesystem,Sorry; I forgot the tests...I will submit a new patch,This patch adds the requested changes.,,,,,,,,,,
14704,,,,,,,,This has been committed in XWork and will be part of the XWork 2.1 release. See: http://jira.opensymphony.com/browse/XW-541,,,,,,,,,,,,,
64751,x,,,,,,,Thanks for the patch JÌ_rgen. Revision 1028760.,Of course setting this specific import to optional is a good idea - sorry; forgot that!,Thanks for the update JÌ_rgen. Anyway; I prefer to set the import package as optional in Jetty bundle pom. I'm gonna make some tests and keep you posted. Regards JB,Added import for manifest,,,,,,,,,,
41195,x,,,,,,,Thanks to Hazem Saleh for provide us this enhancement fixed at revision 655653,The patch!!!,,,,,,,,,,,,
19946,,,,,,,,Is there any documentation such as 'getting started with swarm' available? If there is; could you share links? Thanks.,,,,,,,,,,,,,
75490,,,,,,,,Ok; since you have a workaround I will close this.,I am using Sun Java 1.6.0_11 on Windows XP x86-32 bit Service Pack 3 + all current patches. It turns out that the class was already final in 1.4.1. Further debugging revealed that putting the xml-sec 1.4.2 jar file on the Java endorsed path resolved the issue. Specifically the problem was that the class org.jcp.xml.dsig.internal.dom.DOMHMACSignatureMethod contains inner classes in 1.4.2 which are not in the version shipped in the Sun Java 1.6.0_11 rt.jar.,Unfortunately; the change to make XMLSignature a final class does break any existing subclasses. But this is the first case I have heard of an issue. So a question for you is why do you need to subclass it?,,,,,,,,,,,
52597,x,,,,,,,thanks Malith for your contribution...patch committed under rev. 1326522,,,,,,,,,,,,,
15073,,,,,,,,duplicate of WW-1598,,,,,,,,,,,,,
14849,,,,,,,,Reporter asked for this to be closed.,,,,,,,,,,,,,
54763,,,,,,,,Fixed.,,,,,,,,,,,,,
31087,x,,,,,,,Patch applied. Thanks Florian.,,,,,,,,,,,,,
44873,,,,,,x,,This has been fixed for 1.1 by Upgading to POI 3.8 beta 5. Perhaps somebody with more power than me can mark this accordingly.,,,,,,,,,,,,,
57286,,,,,x,,,Not quite 100% done. Will finish in 4.2.2.,Changes in rev. 642015 merged in 4.2.x branch thus: http://svn.apache.org/viewvc?view=rev&revision=648752,Thanks. I'm still working on a patch for rw_tmpnam().,I verified that the changes made didn't break the fix to STDCXX-421. the testcase: export TMPDIR=/build/scottz/tmp; rm -rf $TMPDIR/*; ./exec -t 10 en_IN.UTF-8.sh still function properly.,The POSIX function tempnam doesn't fully specify how the name of the directory is obtained when the dir argument to the function is NULL. All known platforms (AIX; FreeBSD; HP-UX; IRIX; Linux; Solaris; Tru64) implement the following behavior: use the TMPDIR environment variable if it is set to a valid directory; otherwise use the dir argument if it points to a valid directory; otherwise us the P_tmpdir macro if it is defined to a valid directory in <stdio.h>; otherwise use /tmp The P_tmpdir macro is #defined to /tmp on AIX; Linux and Tru64 UNIX; and to /var/tmp on FreeBSD; HP-UX; Solaris; and IRIX.,See the following post(s) for proposed patches and a discussion: http://www.nabble.com/STDCXX-401-tt15967805.html http://www.nabble.com/-PATCH--STDCXX-401-part-2-tt15990851.html,The POSIX variable is actually TMPDIR _x0089_ÛÒ see http://www.opengroup.org/onlinepubs/009695399/basedefs/xbd_chap08.html#tag_08_03 Scheduled for sometime after 4.2.,Lowered priority.,,,,,,
46068,,,,x,,,,Integrated in Thrift #230 (See https://builds.apache.org/job/Thrift/230/) THRIFT-1284. cpp: fix processor inheritance Don't make processors that have a proper parent class also inherit from TProcessor. Patch: Adam Simpkins bryanduxbury : http://svn.apache.org/viewvc/?view=rev&rev=1160933 Files : /thrift/trunk/compiler/cpp/src/generate/t_cpp_generator.cc,I just committed this.,,,,,,,,,,,,
57316,,,,,,,,Fixed with the referenced change.,,,,,,,,,,,,,
409,,,,,,,,I'm backporting this to 3.4 and 3.3 branches. --Michi,,,,,,,,,,,,,
60817,,,,,,,,removing fixVersion=4.0 since there is no evidence that anyone is currently working on this issue. (this can certainly be revisited if volunteers step forward),,,,,,,,,,,,,
15793,,,,,,,,This has been fixed in CVS. You can get the latest xwork.jar (which fixes the problem) from http://ivyrep.opensymphony.com,,,,,,,,,,,,,
5491,,,,,,,,reg_name has been accepted as valid URI syntax since Xerces 2.6.0. This may change in the future if XML Schema 1.0 moves up to the RFC 3986 syntax which excludes this production. Xerces CVS currently supports the XML Schema 1.0; 2nd edition which still references RFC 2396 for the anyURI type. The version of XML Schema 1.0 supported will be clearly marked in the documentation. The relevant RFCs for anyURI may be emphasized in a FAQ.,Interesting - you guys are doing a great job. I raised the issue against 2.5 because that is what Stylus Studio ships with. Given the comment from Roy Fielding its a shame that the Digital Radio Mondiale team who wrote ETSI TS 102 821 didn't register their URI schema. In fact this URI schema has some practical problems and it being esentially deprecated by RFC 3986 is an argument I can use to try and get it changed. Luckily Annex C is informative; not normative. I will try and get the ETSI spec changed and definately not incorporate the deprecated URI in the XML schema we are designing. We have a Digital Radio Mondiale meeting next week where I should be able to get this going. I think XERCES should follow (and track) the W3C standard so the current 2.6 behaviour is correct; the 2.5 behaviour is incorrect and if W3C changes the schema spec to reference 3986 then XERCES should change with it. As far as this bug is concerned it doesn't seem like you need to implement anything but it would be nice if the exact syntax accepted by the tool was somewhere in the user documentation (if it is then my mistake but I couldn't find it by googling). Julian,Just to clarify... The report was opened against Xerces 2.5.0. Xerces has allowed the reg_name syntax since Xerces 2.6.0; so as of today the schema validator will accept dcp.tcp.pft://192.168.0.1:1002:3002?fec=1&crc=0 as a valid value of type anyURI.,Roy Fielding has confirmed that this was a deliberate decision; and is indeed an incompatibility between 2396 and 3986. According to him; 'No URI schemes were defined using the reg_name syntax of 2396; and therefore it was removed.' Probably; nobody should be using such syntax now. What to do now? This is a tough call; but I tend to fall back on the letter of the law (or the spec). The schemas spec references 2396; not 3986. Therefore Xerces should be changed to allow this syntax. This might change in schema 1.1 though; which will likely reference 3986; not 2396. However; the current working draft still references RFC 2396. I've asked the schema working group to consider this issue.,The colon isn't the only issue. The @ sign is also prohibited in reg-names in 3986 and allowed in 2396. I wonder what the working group was thinking? I suspect they were trying to make it easier to distinguish reg-names from host-based authorities; and allow user info and port to be specified for registry based authorities. This particular issue is not listed in Appendix D2 of 3986; Modifications; so I wonder if the working group noticed it?,RFC 3986 does seem to prohibit this URI. In 3986 we have: åÊåÊåÊreg-name = *( unreserved / pct-encoded / sub-delims ) åÊåÊåÊunreserved = ALPHA / DIGIT / '-' / '.' / '_' / '~' åÊåÊåÊsub-delims = '!' / '$' / '&' / ''' / '(' / ')' åÊåÊåÊåÊåÊåÊåÊåÊåÊåÊåÊåÊåÊåÊåÊåÊåÊ/ '*' / '+' / ';' / ';' / '=' In 3986 the colon is a general delimiter; not a sub delimiter. I'm not sure what should be done here. Schemas Part 2 normatively references 2396; not 3986; so I suppose this should be allowed. On the other hand; I can't help but think that this is really a bug in the definition of reg-names in 2396.,The value space for anyURI [1] is defined by RFC 2396 (and RFC 2732). dcp.tcp.pft://192.168.0.1:1002:3002?fec=1&crc=0 is allowed by the grammar since '192.168.0.1:1002:3002' matches reg_name. Registry-based Naming Authority (reg_name) has been supported since Xerces 2.6.0. authority = server | reg_name reg_name = 1*( unreserved | escaped | '$' | ';' | åÊåÊåÊåÊåÊåÊåÊåÊåÊåÊåÊåÊåÊåÊåÊåÊ';' | ':' | '@' | '&' | '=' | '+' ) unreserved = alphanum | mark mark = '-' | '_' | '.' | '!' | '~' | '*' | ''' | åÊåÊåÊåÊåÊåÊåÊåÊåÊåÊåÊåÊåÊåÊåÊåÊ'(' | ')' If RFC 3986 prohibits this URI then it seems the new RFC is not backwards compatible with RFC 2396. [1] http://www.w3.org/TR/2004/REC-xmlschema-2-20041028/#anyURI,Xerces is correct. This URI is syntactically incorrect according to RFC 3986. The authority component cannot have two colons when used with an IPv4 literal address. In essence; this URI tries to have two ports. I'm not familiar with the spoec you reference; but it does not appear to be conformant to the URI specification.,,,,,,
58877,,,,,,,,I haven't seen any bad behavior. I was using open ssh to test this. I used the escape character; ~; and the period character; .; with open ssh to disconnect; '~.'.,,,,,,,,,,,,,
14387,,,,,,,,we're moving away from dojo integration in struts2; so you won't likely get much traction on this issue. If you want/need this resolved; then reopen; but provide a patch that we can apply. The core devs aren't going to allocate time to the dojo plugin at this point.,,,,,,,,,,,,,
22691,,,,,,,,By the way; the javadoc for the minimum and maximum validators are still not updated (and incorrect). They need to be precise as to whether or not the endpoints are included. For example: * Gets a Double maximum validator for checking if an number is smaller than the given maximum Should read 'is at most' or 'smaller than or equal to'. Same with the other validators (including the range validators).,,,,,,,,,,,,,
4223,,,,,,,,Updated in 1.2 branch. David; please download and try 1.2 beta when it is released in a week or so.,,,,,,,,,,,,,
10856,,,,,,,,I think with the latest code; this 'pop' message should only show up if an AVT is used with an incorrect value. If AVT's aren't used; the error should be caught statically and you should see the message: Illegal value: sideways used for ENUM attribute: order. Valid values are: ascending descending. Do we have a testcase where the invalid value is in an AVT?,,,,,,,,,,,,,
36376,,,,,x,,,Oops; commit message had wrong ticket number in it; here is the commit: Author: sjiang Date: Fri Mar 19 00:59:56 2010 New Revision: 925063 URL: http://svn.apache.org/viewvc?rev=925063&view=rev Log: TS-260: fix remap filtering and parsing of src_ip Modified: incubator/trafficserver/traffic/trunk/proxy/http2/remap/UrlRewrite.cc Modified: incubator/trafficserver/traffic/trunk/proxy/http2/remap/UrlRewrite.cc URL: http://svn.apache.org/viewvc/incubator/trafficserver/traffic/trunk/proxy/http2/remap/UrlRewrite.cc?rev=925063&r1=925062&r2=925063&view=diff,Fixed previously removed filter implementation to parse src_ip and handle filtering.,,,,,,,,,,,,
